Bureau of Justice Statistics,,,,,,,
Filename: p07at18.csv,,,,,,,
"Appendix table 18. Number of detainees held by U.S. Immigration and Customs Enforcement (ICE), by facility type, December 31, 2006 and 2007",,,,,,,
Report title: Prisoners in 2007 NCJ 224280,,,,,,,
"Data source: National Prisoner Statistics, 1b",,,,,,,
"Authors: Heather C. West and William J. Sabol, Ph.D.",,,,,,,
Refer questions to: askbjs@usdoj.gov   202-307-0765,,,,,,,
"Date of version: December 2, 2008",,,,,,,

"Appendix table 18. Number of detainees held by U.S. Immigration and Customs Enforcement (ICE), by facility type, December 31, 2006 and 2007",,,,,,,
Facility type,,2006,,"2,007",,"Percent change, 2006-2007",
Total,,"27,368",,"30,431",,11,%
,Intergovernmental Service Agreement and Bureau of Prisons,"17,753",,"20,711",,16.7,
,ICE owned and contract,"9,615",,"9,720",,1.1,
Note: Not comparable with numbers reported prior to 2006. The classification of categories have changed.,,,,,,,
